{
  "evidenceId":"SRC_PUB_003","title":"Presentation Trainer: What Experts and Computers Can Tell About Your Nonverbal Communication","authors":["Jan Schneider","Dirk Borner","Peter van Rosmalen","Marcus Specht"],"year":2017,"doi":"10.1111/jcal.12175","officialUrl":"https://onlinelibrary.wiley.com/doi/10.1111/jcal.12175","fileSha256":null,
  "metricDefinition":"The abstract describes expert-derived nonverbal communication practices and a multimodal feedback prototype, without exposing a transferable scoring formula.","thresholdExists":false,"thresholdValue":null,"unit":null,"extractionLocations":[],"mapping":{"relation":"NOT_APPLICABLE","faceFitMetricId":"SPEECH_CLIPPING_SAMPLE_RATIO"},
  "access":{"accessLevel":"OFFICIAL_ABSTRACT_ONLY","reviewDepth":"ABSTRACT_REVIEWED","retrievedAt":"2026-08-04T00:00:00Z","retrievalSource":"DOI_PUBLISHER"},
  "study":{"context":"PUBLIC_SPEAKING","sampleSize":null,"participantDescription":null,"language":null,"countryOrCulture":null,"interviewType":"Expert interview and prototype evaluation","deviceAndEnvironment":null},
  "measurements":[{"paperMetricName":"expert nonverbal-practice rubric","definition":"Expert-identified practices used to reason about public-speaking feedback.","calculationMethod":null,"unit":null,"aggregation":null,"measurementType":"HUMAN_RATING","deviceOrTool":"Presentation Trainer","reportedStatistics":[],"behaviorBoundaryReported":false,"notes":["The abstract does not define capture-quality metrics."]}],
  "reportedFindings":[{"summary":"The abstract supports human-expert grounding and warns that automated presentation feedback needs a valid assessment model.","findingType":"HUMAN_RUBRIC","supportsBehaviorThreshold":false}],
  "faceFitMappings":[{"paperMetricName":"expert nonverbal-practice rubric","faceFitMetricId":"SPEECH_CLIPPING_SAMPLE_RATIO","relation":"NOT_APPLICABLE","definitionMatch":false,"unitMatch":false,"calculationMatch":false,"scoringDirectionSupported":false,"numericThresholdSupported":false,"reason":"Audio clipping is a capture-quality condition, not a public-speaking behavior rubric item.","conversion":null}],
  "intendedUses":["CONTEXT","HUMAN_RUBRIC","VALIDATION_DESIGN"],"adoptionStatuses":["ACCEPTED_CONTEXT","ACCEPTED_HUMAN_RUBRIC","ACCEPTED_VALIDATION_DESIGN","REJECTED_FOR_THRESHOLD"],
  "thresholdAssessment":{"behaviorThresholdReported":false,"transferability":"NON_TRANSFERABLE_CONTEXT","productionThresholdUsable":false,"reason":"Expert practices require operationalization and reliability validation before any numeric scoring."},
  "limitations":["Only the official abstract was reviewed.","Expert practices are not interchangeable with raw sensor metrics."],"status":"REVIEW_REQUIRED"
}
