{
  "evidenceId":"SRC_HEAD_003","title":"FSA-Net: Learning Fine-Grained Structure Aggregation for Head Pose Estimation from a Single Image","authors":["Tsun-Yi Yang","Yi-Ting Chen","Yen-Yu Lin","Yung-Yu Chuang"],"year":2019,"doi":"10.1109/CVPR.2019.00118","officialUrl":"https://openaccess.thecvf.com/content_CVPR_2019/html/Yang_FSA-Net_Learning_Fine-Grained_Structure_Aggregation_for_Head_Pose_Estimation_From_CVPR_2019_paper.html","fileSha256":"40c836cb0dda318c0d284d722ca8a24e2c94fc7825d76b5ba8d90ed5d3a9aec5",
  "metricDefinition":"Head pose is a three-angle yaw, pitch, and roll vector estimated for one image; Face-Fit adds a session baseline and answer-level absolute p95.","thresholdExists":false,"thresholdValue":null,"unit":"DEGREE",
  "extractionLocations":[{"page":1,"section":"Introduction","table":null,"figure":null,"description":"Head pose defined as yaw, pitch, and roll angles."},{"page":3,"section":"Method","table":null,"figure":null,"description":"Regression objective uses angle prediction error."}],
  "mapping":{"relation":"PROXY","faceFitMetricId":"HEAD_RELATIVE_YAW_ABS_P95_DEG"},
  "access":{"accessLevel":"FULL_TEXT_PDF","reviewDepth":"FULL_TEXT_REVIEWED","retrievedAt":"2026-08-04T00:00:00Z","retrievalSource":"CVF"},
  "study":{"context":"HEAD_POSE_MEASUREMENT","sampleSize":null,"participantDescription":null,"language":null,"countryOrCulture":null,"interviewType":null,"deviceAndEnvironment":"Single-image RGB benchmark datasets"},
  "measurements":[{"paperMetricName":"head pose vector","definition":"Three-dimensional vector containing yaw, pitch, and roll angles.","calculationMethod":"Single-image regression with fine-grained feature aggregation.","unit":"DEGREE","aggregation":"PER_IMAGE","measurementType":"AUTOMATED","deviceOrTool":"FSA-Net","reportedStatistics":[],"behaviorBoundaryReported":false,"notes":["No answer-level baseline-relative percentile is defined."]},{"paperMetricName":"mean absolute angle error","definition":"Prediction error between estimated and reference pose vectors.","calculationMethod":"Mean absolute error objective and benchmark evaluation.","unit":"DEGREE","aggregation":"MEAN","measurementType":"ALGORITHM_ERROR","deviceOrTool":null,"reportedStatistics":[],"behaviorBoundaryReported":false,"notes":["Measurement error is not behavior quality."]}],
  "reportedFindings":[{"summary":"The paper provides an operational definition of image-based yaw, pitch, and roll estimation.","findingType":"MEASUREMENT_DEFINITION","supportsBehaviorThreshold":false}],
  "faceFitMappings":[
    {"paperMetricName":"yaw component","faceFitMetricId":"HEAD_RELATIVE_YAW_ABS_P95_DEG","relation":"PROXY","definitionMatch":false,"unitMatch":true,"calculationMatch":false,"scoringDirectionSupported":false,"numericThresholdSupported":false,"reason":"Face-Fit applies baseline subtraction, absolute value, and p95 aggregation absent from the paper metric.","conversion":null},
    {"paperMetricName":"pitch component","faceFitMetricId":"HEAD_RELATIVE_PITCH_ABS_P95_DEG","relation":"PROXY","definitionMatch":false,"unitMatch":true,"calculationMatch":false,"scoringDirectionSupported":false,"numericThresholdSupported":false,"reason":"Face-Fit applies baseline subtraction, absolute value, and p95 aggregation absent from the paper metric.","conversion":null},
    {"paperMetricName":"roll component","faceFitMetricId":"HEAD_RELATIVE_ROLL_ABS_P95_DEG","relation":"PROXY","definitionMatch":false,"unitMatch":true,"calculationMatch":false,"scoringDirectionSupported":false,"numericThresholdSupported":false,"reason":"Face-Fit applies baseline subtraction, absolute value, and p95 aggregation absent from the paper metric.","conversion":null}
  ],
  "intendedUses":["METRIC_DEFINITION","QUALITY_GATE","MEASUREMENT_LIMITATION","VALIDATION_DESIGN"],"adoptionStatuses":["ACCEPTED_METRIC_DEFINITION","ACCEPTED_QUALITY_GATE","ACCEPTED_MEASUREMENT_LIMITATION","ACCEPTED_VALIDATION_DESIGN","REJECTED_FOR_THRESHOLD"],
  "thresholdAssessment":{"behaviorThresholdReported":false,"transferability":"MEASUREMENT_ERROR_ONLY","productionThresholdUsable":false,"reason":"Training and benchmark error values cannot be used as behavioral scoring limits."},
  "limitations":["Head pose does not establish attention or eye contact.","Single-frame benchmark performance does not establish webcam session behavior validity."],"status":"REVIEW_REQUIRED"
}
