{
  "evidenceId":"SRC_INT_001","title":"Why Visual and Vocal Interview Cues Can Affect Interviewers' Judgments and Predict Job Performance","authors":["Timothy DeGroot","Stephan J. Motowidlo"],"year":1999,"doi":"10.1037/0021-9010.84.6.986","officialUrl":"https://doi.org/10.1037/0021-9010.84.6.986","fileSha256":null,
  "metricDefinition":"A vocal-cue composite included pitch, pitch variability, speech rate, pauses, and amplitude variability; the abstract does not expose component formulas or units.","thresholdExists":false,"thresholdValue":null,"unit":null,
  "extractionLocations":[],"mapping":{"relation":"PROXY","faceFitMetricId":"SPEECH_WORDS_PER_MINUTE"},
  "access":{"accessLevel":"OFFICIAL_ABSTRACT_ONLY","reviewDepth":"ABSTRACT_REVIEWED","retrievedAt":"2026-08-04T00:00:00Z","retrievalSource":"DOI_PUBLISHER"},
  "study":{"context":"EMPLOYMENT_INTERVIEW","sampleSize":60,"participantDescription":null,"language":null,"countryOrCulture":null,"interviewType":"Recorded employment interview","deviceAndEnvironment":null},
  "measurements":[{"paperMetricName":"vocal interview cue composite","definition":"Composite representation of several vocal cues named in the abstract.","calculationMethod":null,"unit":null,"aggregation":"COMPOSITE","measurementType":"MODEL_INPUT","deviceOrTool":null,"reportedStatistics":[],"behaviorBoundaryReported":false,"notes":["Component formulas and standalone units were not available in the reviewed abstract."]}],
  "reportedFindings":[{"summary":"The abstract reports an association between a vocal-cue composite and supervisory job-performance ratings.","findingType":"ASSOCIATION","supportsBehaviorThreshold":false}],
  "faceFitMappings":[
    {"paperMetricName":"speech rate within vocal cue composite","faceFitMetricId":"SPEECH_WORDS_PER_MINUTE","relation":"PROXY","definitionMatch":false,"unitMatch":false,"calculationMatch":false,"scoringDirectionSupported":false,"numericThresholdSupported":false,"reason":"The abstract names speech rate only as part of a composite and gives no WPM definition.","conversion":null},
    {"paperMetricName":"pauses within vocal cue composite","faceFitMetricId":"SPEECH_TOTAL_INTERWORD_GAP_MS","relation":"PROXY","definitionMatch":false,"unitMatch":false,"calculationMatch":false,"scoringDirectionSupported":false,"numericThresholdSupported":false,"reason":"Interview pauses are not defined as the sum of adjacent STT word-timestamp gaps.","conversion":null},
    {"paperMetricName":"amplitude variability within vocal cue composite","faceFitMetricId":"SPEECH_RMS_DBFS","relation":"PROXY","definitionMatch":false,"unitMatch":false,"calculationMatch":false,"scoringDirectionSupported":false,"numericThresholdSupported":false,"reason":"Amplitude variability is not whole-answer RMS in dBFS and capture gain is unspecified.","conversion":null},
    {"paperMetricName":"pitch variability within vocal cue composite","faceFitMetricId":"SPEECH_F0_RANGE_HZ","relation":"PROXY","definitionMatch":false,"unitMatch":false,"calculationMatch":false,"scoringDirectionSupported":false,"numericThresholdSupported":false,"reason":"Pitch variability is not confirmed as maximum-minus-minimum physical F0.","conversion":null}
  ],
  "intendedUses":["CONTEXT","AXIS_SELECTION"],"adoptionStatuses":["ACCEPTED_CONTEXT","ACCEPTED_AXIS_SELECTION","EXPERIMENTAL_ONLY","REJECTED_FOR_THRESHOLD"],
  "thresholdAssessment":{"behaviorThresholdReported":false,"transferability":"NONE_REPORTED","productionThresholdUsable":false,"reason":"The abstract reports association evidence, not a transferable behavior boundary."},
  "limitations":["Only the official abstract and registered metadata were reviewed.","The vocal cues form a composite and cannot define standalone Face-Fit metric scoring."],"status":"REVIEW_REQUIRED"
}
