{
  "evidenceId":"SRC_POSE_002","title":"Evaluation of 3D Markerless Motion Capture Accuracy Using OpenPose With Multiple Video Cameras","authors":["Nobuyasu Nakano","Tetsuro Sakura","Kazuhiro Ueda","Leon Omura","Arata Kimura","Yoichi Iino","Senshi Fukashiro","Shinsuke Yoshioka"],"year":2020,"doi":"10.3389/fspor.2020.00050","officialUrl":"https://www.frontiersin.org/journals/sports-and-active-living/articles/10.3389/fspor.2020.00050/full","fileSha256":null,
  "metricDefinition":"OpenPose keypoints from multiple cameras are reconstructed in 3D and compared with marker-based joint positions; errors describe measurement accuracy.","thresholdExists":false,"thresholdValue":null,"unit":"MILLIMETER",
  "extractionLocations":[{"page":null,"section":"Markerless Motion Capture","table":null,"figure":"Figure 1","description":"Camera, OpenPose keypoint, calibration, and reconstruction procedure."},{"page":null,"section":"Data Analysis","table":null,"figure":null,"description":"Joint-position mean absolute error definition."},{"page":null,"section":"Results","table":"Table 1","figure":null,"description":"Joint-position errors retained only as measurement limitations."}],
  "mapping":{"relation":"PROXY","faceFitMetricId":"QUALITY_POSTURE_AVAILABILITY_RATIO"},
  "access":{"accessLevel":"OFFICIAL_HTML_FULL_TEXT","reviewDepth":"FULL_TEXT_REVIEWED","retrievedAt":"2026-08-04T00:00:00Z","retrievalSource":"DOI_PUBLISHER"},
  "study":{"context":"POSE_MEASUREMENT","sampleSize":2,"participantDescription":null,"language":null,"countryOrCulture":null,"interviewType":null,"deviceAndEnvironment":"Five synchronized cameras and laboratory reference motion capture"},
  "measurements":[{"paperMetricName":"joint-position mean absolute error","definition":"Difference between OpenPose-based and marker-based joint positions over movement intervals.","calculationMethod":"Mean absolute error across corresponding 3D joint-position time series.","unit":"MILLIMETER","aggregation":"MEAN","measurementType":"ALGORITHM_ERROR","deviceOrTool":"OpenPose and multi-camera reconstruction","reportedStatistics":[],"behaviorBoundaryReported":false,"notes":["Accuracy results must not become posture behavior limits."]}],
  "reportedFindings":[{"summary":"Tracking failures and joint-position errors vary by task and capture condition, supporting explicit quality gating.","findingType":"MEASUREMENT_LIMITATION","supportsBehaviorThreshold":false}],
  "faceFitMappings":[{"paperMetricName":"tracking success and joint-position error","faceFitMetricId":"QUALITY_POSTURE_AVAILABILITY_RATIO","relation":"PROXY","definitionMatch":false,"unitMatch":false,"calculationMatch":false,"scoringDirectionSupported":false,"numericThresholdSupported":false,"reason":"The study supports measuring pose reliability but does not define Face-Fit available-frame ratio.","conversion":null}],
  "intendedUses":["QUALITY_GATE","MEASUREMENT_LIMITATION","VALIDATION_DESIGN"],"adoptionStatuses":["ACCEPTED_QUALITY_GATE","ACCEPTED_MEASUREMENT_LIMITATION","ACCEPTED_VALIDATION_DESIGN","REJECTED_FOR_THRESHOLD"],
  "thresholdAssessment":{"behaviorThresholdReported":false,"transferability":"MEASUREMENT_ERROR_ONLY","productionThresholdUsable":false,"reason":"Joint-position errors are algorithm validity results, not acceptable interview posture."},
  "limitations":["Multi-camera 3D sports tasks do not match a seated single-webcam interview.","Quality availability may gate measurement only and must not penalize behavior."],"status":"REVIEW_REQUIRED"
}
