{
  "evidenceId":"SRC_POSE_004","title":"Influence of the Camera Viewing Angle on OpenPose Validity in Motion Analysis","authors":["Melanie Baldinger","Lara Marie Reimer","Veit Senner"],"year":2025,"doi":"10.3390/s25030799","officialUrl":"https://pmc.ncbi.nlm.nih.gov/articles/PMC11819822/","fileSha256":null,
  "metricDefinition":"OpenPose joint angles from multiple viewing directions are compared with marker-based motion capture to quantify view-dependent validity.","thresholdExists":false,"thresholdValue":null,"unit":"DEGREE",
  "extractionLocations":[{"page":null,"section":"2.2 Experimental Setup","table":null,"figure":null,"description":"Camera-view and marker-based comparison design."},{"page":null,"section":"3 Results","table":"Table 2","figure":null,"description":"Agreement by joint and viewing angle."},{"page":null,"section":"4 Discussion","table":null,"figure":null,"description":"View-dependent bias and shoulder-joint validity limitations."}],
  "mapping":{"relation":"NOT_APPLICABLE","faceFitMetricId":"POSTURE_RELATIVE_SHOULDER_TILT_ABS_P95_DEG"},
  "access":{"accessLevel":"OFFICIAL_HTML_FULL_TEXT","reviewDepth":"FULL_TEXT_REVIEWED","retrievedAt":"2026-08-04T00:00:00Z","retrievalSource":"PMC"},
  "study":{"context":"POSE_MEASUREMENT","sampleSize":20,"participantDescription":null,"language":null,"countryOrCulture":null,"interviewType":null,"deviceAndEnvironment":"Four camera views and laboratory marker-based reference"},
  "measurements":[{"paperMetricName":"view-dependent joint-angle validity","definition":"Agreement and bias of OpenPose-derived knee, hip, elbow, and shoulder joint angles against reference motion capture.","calculationMethod":"Joint-angle comparison across camera viewing directions.","unit":"DEGREE","aggregation":"AGREEMENT_ANALYSIS","measurementType":"ALGORITHM_ERROR","deviceOrTool":"OpenPose and Vicon","reportedStatistics":[],"behaviorBoundaryReported":false,"notes":["A shoulder joint angle is not a left-right shoulder-line tilt metric."]}],
  "reportedFindings":[{"summary":"Camera viewing direction materially affects markerless joint-angle validity and the shoulder result requires particular caution.","findingType":"MEASUREMENT_LIMITATION","supportsBehaviorThreshold":false}],
  "faceFitMappings":[{"paperMetricName":"shoulder joint-angle validity","faceFitMetricId":"POSTURE_RELATIVE_SHOULDER_TILT_ABS_P95_DEG","relation":"NOT_APPLICABLE","definitionMatch":false,"unitMatch":true,"calculationMatch":false,"scoringDirectionSupported":false,"numericThresholdSupported":false,"reason":"The shared angular unit does not make a shoulder joint angle equivalent to a left-right shoulder-line tilt.","conversion":null}],
  "intendedUses":["QUALITY_GATE","MEASUREMENT_LIMITATION","VALIDATION_DESIGN"],"adoptionStatuses":["ACCEPTED_QUALITY_GATE","ACCEPTED_MEASUREMENT_LIMITATION","ACCEPTED_VALIDATION_DESIGN","REJECTED_FOR_THRESHOLD"],
  "thresholdAssessment":{"behaviorThresholdReported":false,"transferability":"MEASUREMENT_ERROR_ONLY","productionThresholdUsable":false,"reason":"View-dependent validity results are algorithm limitations, not behavior boundaries."},
  "limitations":["Dynamic laboratory tasks and multiple viewing directions differ from a seated webcam interview.","Shoulder joint-angle semantics must not be substituted for shoulder-line tilt."],"status":"REVIEW_REQUIRED"
}
